fileid,tokens,sentences,token_count,type_count,sentence_count,lexical_diversity
bad_santa.txt,"['If', 'you', 'use', '``', 'bad', ""''"", 'to', 'mean', '``', 'good', ""''"", ',', 'then', 'Bad', 'Santa', 'is', 'very', 'bad', ',', 'indeed', '.', 'Billy', 'Bob', 'Thorton', 'plays', 'Willy', 'Stokes', ',', 'a', 'drunkard/safecracker', ',', 'who', 'with', 'the', 'help', 'of', 'his', 'dwarf-friend', 'Marcus', '(', 'Tony', 'Cox', ')', 'robs', 'shopping', 'malls', 'after', 'posing', 'as', 'Santa', 'during', 'the', 'holiday', 'season', '.', 'On', 'this', 'particular', 'go', ',', 'the', 'pair', 'winds', 'up', 'in', 'Arizona', ',', 'an', 'inspired', 'choice', 'since', 'the', 'Southern', 'California', 'thing', 'has', 'been', 'done', 'to', 'death', '.', 'John', 'Ritter', 'plays', 'a', 'department', 'store', 'manager', ',', 'who', 'in', 'an', 'attempt', 'to', 'cut-costs', ',', 'fires', 'the', 'store', ""'s"", 'regular', 'Santa', 'and', 'hires', 'the', 'cheaper', 'Billy-bob', '.', 'Then', ',', 'the', 'fun', 'begins', '...', 'Billy-bob', 'is', 'so', 'unredeemable', 'and', 'disgusting', 'that', 'you', 'ca', ""n't"", 'help', ',', 'but', 'laugh', 'when', 'brat', 'after', 'brat', 'climbs', 'aboard', 'his', 'tipsy', 'lap', 'and', 'lists', 'their', 'demands', '.', 'Billy-Bob', 'whines', 'and', 'scowls', 'his', 'way', 'through', 'each', 'day', ',', 'and', 'store', 'manager', ',', 'John', 'Ritter', ',', 'and', 'partner', 'in', 'crime', ',', 'Tony', 'Cox', 'become', 'more', 'and', 'more', 'agitated', 'by', 'Billy', 'Bob', ""'s"", 'behavior', '.', 'Meanwhile', ',', 'Billy-bob', 'has', 'met', 'Sue', '(', 'Lauren', 'Graham', ')', ',', 'who', 'has', 'a', 'thing', 'for', 'being', 'naughty', ',', 'and', 'a', 'chubby', 'snot-nosed', 'loser', 'played', 'perfectly', 'by', 'Brett', 'Kelly', '.', '(', 'Brett', ""'s"", 'performance', 'is', 'perfect', ';', 'he', 'at', 'once', 'is', 'repulsive', 'and', 'yet', ',', 'somehow', 'sympathetic', '.', ')', 'The', 'movie', ',', 'however', ',', 'begins', 'to', 'take', 'a', 'dark', 'turn', 'with', 'about', 'thirty', 'minutes', 'left', '.', 'The', 'mall', ""'s"", 'security', 'officer', 'finds', 'out', 'about', 'the', 'previous', 'mall', 'robberies', 'by', 'Marcus', 'and', 'Willy', ',', 'and', 'blackmails', 'the', 'pair', '.', 'That', 'in', 'itself', 'would', ""n't"", 'be', 'so', 'bad', ',', 'but', 'eventually', 'Marcus', 'and', 'his', 'horrible', 'girlfriend', 'kill', 'the', 'security', 'guard', 'and', 'during', 'their', 'annual', 'robbery', ',', 'double-cross', 'Billy-bob', '.', 'By', 'this', 'point', ',', 'Billy-bob', 'has', 'not', 'exactly', 'reformed', 'his', 'ways', ',', 'but', 'now', ',', 'at', 'least', 'cares', 'enough', 'about', 'the', 'fat', 'loser', 'kid', 'to', 'want', 'to', 'get', 'him', 'a', 'gift', '(', 'a', 'pink', 'elephant', ')', '.', 'He', ""'s"", 'chased', 'to', 'the', 'kid', '’', 's', 'house', 'where', 'he', ""'s"", 'shot', 'eight', 'times', 'while', 'trying', 'to', 'deliver', 'the', 'stuffed', 'elephant', '.', 'I', 'guess', 'to', 'the', 'tune', 'of', 'a', 'Christmas', 'miracle', ',', 'he', 'survives', '.', 'The', 'film', 'manages', 'to', 'revive', 'itself', 'a', 'little', 'with', 'a', 'letter', 'that', 'Billy-Bob', 'sends', 'the', 'fat', 'kid', 'from', 'prison', 'and', 'the', 'movie', 'ends', ',', 'happily', '.', 'I', 'really', 'enjoyed', 'most', 'of', 'this', 'film', '.', 'The', 'focus', 'group', 'ending', 'bothered', 'me', ';', 'it', 'felt', 'a', 'little', 'bit', 'like', 'the', 'writer', 'did', ""n't"", 'know', 'how', 'to', 'end', 'it', '.', 'I', 'was', ""n't"", 'a', 'huge', 'fan', 'of', 'the', 'dark', 'turn', 'it', 'took', ',', 'but', 'I', 'did', ""n't"", 'think', 'it', 'hurt', 'the', 'film', 'as', 'much', 'as', 'the', 'happy', 'ending', '.', 'The', 'performances', 'were', 'all', 'really', 'fantastic', '(', 'all', 'the', 'supporting', 'cast', 'did', 'wonderful', 'jobs', ')', '.', 'The', 'script', 'could', 'have', 'used', 'some', 'tightening', 'near', 'the', 'end', ',', 'but', 'as', 'I', 'said', ',', 'the', '``', 'letter', ""''"", 'made', 'up', 'for', 'it', 'a', 'bit', '.', 'I', 'would', 'highly', 'recommend', 'this', 'to', 'anyone', 'who', 'thinks', 'what', 'the', 'malls', 'have', 'done', 'to', 'Christmas', 'is', 'a', 'crime', '.']","['If you use ""bad"" to mean ""good"", then Bad Santa is very bad, indeed.', 'Billy Bob Thorton plays Willy Stokes, a drunkard/safecracker, who with the help of his dwarf-friend Marcus (Tony Cox) robs shopping malls after posing as Santa during the holiday season.', 'On this particular go, the pair winds up in Arizona, an inspired choice since the Southern California thing has been done to death.', ""John Ritter plays a department store manager, who in an attempt to cut-costs, fires the store's regular Santa and hires the cheaper Billy-bob."", ""Then, the fun begins...  \r\n \r\nBilly-bob is so unredeemable and disgusting that you can't help, but laugh when brat after brat climbs aboard his tipsy lap and lists their demands."", ""Billy-Bob whines and scowls his way through each day, and store manager, John Ritter, and partner in crime, Tony Cox become more and more agitated by Billy Bob's behavior."", 'Meanwhile, Billy-bob has met Sue (Lauren Graham), who has a thing for being naughty, and a chubby snot-nosed loser played perfectly by Brett Kelly.', ""(Brett's performance is perfect; he at once is repulsive and yet, somehow sympathetic.)"", 'The movie, however, begins to take a dark turn with about thirty minutes left.', ""The mall's security officer finds out about the previous mall robberies by Marcus and Willy, and blackmails the pair."", ""That in itself wouldn't be so bad, but eventually Marcus and his horrible girlfriend kill the security guard and during their annual robbery, double-cross Billy-bob."", 'By this point, Billy-bob has not exactly reformed his ways, but now, at least cares enough about the fat loser kid to want to get him a gift (a pink elephant).', ""He's chased to the kid’s house where he's shot eight times while trying to deliver the stuffed elephant."", 'I guess to the tune of a Christmas miracle, he survives.', 'The film manages to revive itself a little with a letter that Billy-Bob sends the fat kid from prison and the movie ends, happily.', 'I really enjoyed most of this film.', ""The focus group ending bothered me; it felt a little bit like the writer didn't know how to end it."", ""I wasn't a huge fan of the dark turn it took, but I didn't think it hurt the film as much as the happy ending."", 'The performances were all really fantastic (all the supporting cast did wonderful jobs).', 'The script could have used some tightening near the end, but as I said, the ""letter"" made up for it a bit.', 'I would highly recommend this to anyone who thinks what the malls have done to Christmas is a crime.']",516,264,21,0.5116279069767442
cat_in_the_hat.txt,"['Let', ""'s"", 'start', 'at', 'the', 'beginning', '.', 'I', 'adore', 'Disney', ""'s"", 'Haunted', 'Mansion', 'in', 'the', 'Orlando', 'theme', 'park', '.', 'It', 'is', 'for', 'everybody', '.', 'It', 'is', 'funny/scary', ',', 'and', 'as', 'Disney', 'caters', 'to', 'CHILDREN', ',', 'all', 'is', 'as', 'it', 'should', 'be', '.', 'Things', 'are', 'themed', 'to', 'death', ',', 'ghosts', ',', 'and', 'the', 'supernatural', 'in', 'a', 'very', 'fun', 'and', 'creative', 'climate', '.', 'Beginning', 'with', '``', 'no', 'windows', 'and', 'no', 'doors', ',', ""''"", 'you', 'are', 'sucked', 'right', 'into', 'the', 'spirit', 'of', 'the', 'house', '-', 'moving', 'doors', ',', 'talking', 'head', 'in', 'a', 'crystal', 'ball', ',', 'hearse', 'with', 'skeleton', 'horse', 'attached', ',', 'tombstones', 'with', 'funny', 'saying', 'on', 'it', '.', 'The', 'ride', 'is', 'absolutely', 'very', 'well', 'done', '!', 'I', 'see', 'something', 'new', 'every', 'time', 'I', 'take', 'the', 'ride', 'and', 'I', ""'ve"", 'done', 'it', 'well', 'over', '12', 'times', '.', 'Okay', '-', 'now', 'let', ""'s"", 'translate', 'that', 'thought', 'into', 'a', 'movie', '!', 'What', 'a', 'fantastic', 'idea', '!', 'The', 'very', 'first', 'line', '``', 'Welcome', 'foolish', 'mortals', ""''"", 'made', 'me', 'just', 'giggle', '.', 'You', 'begin', 'the', 'film', 'with', 'a', 'married', 'couple', 'with', '2', 'kids', '(', 'pretty', 'standard', 'Disney', 'stuff', ')', ',', 'and', 'the', 'dad', 'is', 'too', 'busy', 'at', 'work', '(', 'again', ',', 'par', 'for', 'the', 'course', ',', 'but', 'we', 'have', 'been', 'doing', 'this', 'since', 'at', 'least', '``', 'Mary', 'Poppins', ',', ""''"", 'you', 'know', '?', ')', '.', 'So', 'with', 'one', 'phone', 'call', ',', 'the', 'family', 'is', 'drawn', 'into', '``', 'the', 'house', '.', ""''"", 'That', 'the', 'dad', 'is', 'Eddie', 'Murphy', 'to', 'me', 'is', ""n't"", 'that', 'special', 'a', 'thing', '.', 'I', 'think', 'Eddie', 'Murphy', 'is', 'less', 'funny', 'than', 'he', 'used', 'to', 'be', ',', 'but', 'he', 'is', 'one', 'of', 'only', 'a', 'handful', 'of', 'comedic', 'black', 'movie', 'stars', 'today', '.', 'You', 'enter', 'the', 'house', 'and', 'see', 'the', 'cobwebs', 'on', 'the', 'grandiose', 'front', 'entryhall', '.', 'The', 'monolithic', 'ceilings', ',', 'the', 'candlelit', 'hallways', ',', 'the', 'suits', 'of', 'armor', ',', 'the', 'gigantic', 'fireplace', '(', 'might', 'be', 'known', 'as', 'gates', 'of', 'Hell', ',', 'or', 'it', 'might', 'not', ')', '.', 'The', 'busts', 'in', 'the', 'walls', 'move', 'and', 'watch', 'you', ',', 'there', 'are', 'hidden', 'stairways', ',', 'and', 'most', 'and', 'best', 'of', 'all', ',', 'there', 'are', 'ghosts', 'everywhere', '.', 'There', 'are', 'good', 'ones', 'and', 'bad', 'ones', ',', 'and', 'all', 'the', 'family', 'take', 'off', 'in', 'different', 'directions', 'with', 'the', 'mom', 'being', 'the', 'most', 'sought', 'after', 'by', 'the', 'house', ""'s"", 'owner', '.', 'I', ""'m"", 'not', 'going', 'to', 'give', 'away', 'the', 'plot', '.', 'Suffice', 'it', 'to', 'say', 'there', 'is', 'a', 'trip', 'to', 'the', 'cemetery', 'with', 'ghouls', 'worse', 'than', 'in', 'the', 'new', '``', 'Pirates', 'of', 'the', 'Carribean', ""''"", 'movie', '.', 'But', 'they', 'do', ""n't"", 'last', 'long', '.', 'And', ',', 'of', 'course', ',', 'the', 'boy', 'learns', 'to', 'be', 'a', 'man', 'in', 'the', 'process', '.', 'The', 'lady', ""'s"", 'head', 'in', 'the', 'crystal', 'ball', 'is', 'there', ',', 'and', 'she', ""'s"", 'even', 'green', '.', 'There', ""'s"", 'a', 'barber', 'shop', 'quartet', 'of', 'busts', ',', 'and', 'even', 'the', 'hearse', 'fits', 'in', 'there', 'somehow', '.', 'The', 'ending', 'is', 'where', 'the', 'bad', 'guys', 'get', 'their', 'due', ',', 'and', 'it', 'is', ',', 'after', 'all', ',', 'a', 'Disney', 'comedy', '.', 'This', 'movie', 'is', 'not', 'too', 'scary', 'for', 'the', 'youngest', 'of', 'children', ',', 'but', 'the', 'plot', 'might', 'confuse', 'kids', 'under', '8', 'or', '9', '.', 'PG', 'is', 'a', 'good', 'rating', 'for', 'a', 'few', 'mild', 'oaths', '.', 'Generally', ',', 'if', 'everyone', 'would', 'keep', 'in', 'mind', 'that', 'Disney', 'makes', 'things', 'for', 'children', '(', 'and', 'there', 'are', 'always', 'new', 'ones', 'coming', 'along', '!', '!', '!', ')', ',', 'they', 'would', 'know', 'that', 'this', 'is', 'just', 'a', 'wonderful', 'experience', ',', 'compared', 'to', 'THE', 'CAT', 'IN', 'THE', 'HAT', 'which', 'is', 'obscene', 'from', 'what', 'I', ""'ve"", 'heard', 'and', 'read', '.', 'See', 'this', 'movie', ';', 'take', 'anyone', '.', 'It', 'kept', 'my', 'attention', ',', 'and', 'I', 'am', 'very', 'Disney-fied', '.', 'It', 'lasts', '110', 'minutes', ',', 'and', 'they', 'are', 'fabulous', 'times', '.', 'Well', 'acted', ',', 'well', 'conceived', ',', 'and', 'great', 'effects', '.', 'A', 'great', 'Disney', 'romp', '!']","[""Let's start at the beginning."", ""I adore Disney's Haunted Mansion in the Orlando theme park."", 'It is for everybody.', 'It is funny/scary, and as Disney caters to CHILDREN, all is as it should be.', 'Things are themed to death, ghosts, and the supernatural in a very fun and creative climate.', 'Beginning with ""no windows and no doors,"" you are sucked right into the spirit of the house - moving doors, talking head in a crystal ball, hearse with skeleton horse attached, tombstones with funny saying on it.', 'The ride is absolutely very well done!', ""I see something new every time I take the ride and I've done it well over 12 times."", ""Okay - now let's translate that thought into a movie!"", 'What a fantastic idea!', 'The very first line ""Welcome foolish mortals"" made me just giggle.', 'You begin the film with a married couple with 2 kids (pretty standard Disney stuff), and the dad is too busy at work (again, par for the course, but we have been doing this since at least ""Mary Poppins,"" you know?).', 'So with one phone call, the family is drawn into ""the house.""', ""That the dad is Eddie Murphy to me isn't that special a thing."", 'I think Eddie Murphy is less funny than he used to be, but he is one of only a handful of comedic black movie stars today.', 'You enter the house and see the cobwebs on the grandiose front entryhall.', 'The monolithic ceilings, the candlelit hallways, the suits of armor, the gigantic fireplace (might be known as gates of Hell, or it might not).', 'The busts in the walls move and watch you, there are hidden stairways, and most and best of all, there are ghosts everywhere.', ""There are good ones and bad ones, and all the family take off in different directions with the mom being the most sought after by the house's owner."", ""I'm not going to give away the plot."", 'Suffice it to say there is a trip to the cemetery with ghouls worse than in the new ""Pirates of the Carribean"" movie.', ""But they don't last long."", 'And, of course, the boy learns to be a man in the process.', ""The lady's head in the crystal ball is there, and she's even green."", ""There's a barber shop quartet of busts, and even the hearse fits in there somehow."", 'The ending is where the bad guys get their due, and it is, after all, a Disney comedy.', 'This movie is not too scary for the youngest of children, but the plot might confuse kids under 8 or 9.', 'PG is a good rating for a few mild oaths.', 'Generally, if everyone would keep in mind that Disney makes things for children (and there are always new ones coming along!!!', ""), they would know that this is just a wonderful experience, compared to THE CAT IN THE HAT which is obscene from what I've heard and read."", 'See this movie; take anyone.', 'It kept my attention, and I am very Disney-fied.', 'It lasts 110 minutes, and they are fabulous times.', 'Well acted, well conceived, and great effects.', 'A great Disney romp!']",630,296,35,0.46984126984126984
elf.txt,"['There', ""'s"", 'a', 'big', 'hole', 'at', 'the', 'center', 'of', 'Elf', ',', 'and', 'his', 'name', 'is', 'Will', 'Ferrell', '.', 'The', 'movie', ""'s"", 'premise', 'is', 'that', 'Santa', 'Claus', '(', 'Ed', 'Asner', ')', 'accidentally', 'hijacks', 'a', 'baby', 'to', 'the', 'North', 'Pole', '.', 'The', 'baby', 'is', 'named', 'Buddy', '(', 'played', 'by', 'Ferrell', ')', 'and', 'raised', 'by', 'a', 'senior', 'elf', '(', 'Bob', 'Newhart', ')', 'as', 'one', 'of', 'the', 'North', 'Pole', ""'s"", 'own', '.', 'Eventually', ',', 'Buddy', 'is', 'sent', 'back', 'to', 'his', 'home', 'town', 'of', 'New', 'York', 'to', 'find', 'his', 'biological', 'father', '(', 'James', 'Caan', ')', '.', 'The', 'opening', 'scenes', 'are', 'a', 'letter-perfect', 'take-off', 'on', 'the', 'Rankin-Bass', 'Christmas', 'TV', 'specials', '.', 'And', 'Newhart', ""'s"", 'straight-to-the-camera', ',', 'deadpan', 'narration', 'sets', 'the', 'perfect', 'tone', '.', 'But', 'as', 'soon', 'as', 'Buddy', 'hits', 'Manhattan', ',', 'the', 'movie', 'starts', 'going', 'awry', '.', 'There', 'are', 'many', 'scenes', 'of', 'broad', 'physical', 'comedy', 'where', 'Buddy', 'is', 'overawed', 'by', 'modern', 'life', 'and', 'misinterprets', 'people', ""'s"", 'commands', 'to', 'him', '.', 'If', 'ever', 'there', 'was', 'a', 'pregnant', 'premise', 'for', 'comedy', ',', 'a', 'naive', ',', 'six-foot-tall', 'elf', 'set', 'loose', 'in', 'unforgiving', 'New', 'York', 'City', 'ought', 'to', 'be', 'it', '.', 'But', 'Will', 'Ferrell', 'is', 'not', 'the', 'man', 'for', 'the', 'job', '.', 'Steve', 'Martin', 'and', 'Jim', 'Carrey', 'have', 'the', 'wild', 'abandon', 'for', 'this', 'kind', 'of', 'thing', ',', 'and', 'heaven', 'knows', 'what', 'elfin', 'Robin', 'Williams', 'would', 'have', 'done', 'with', 'the', 'role', '.', 'But', 'Ferrell', ',', 'another', 'of', 'those', '``', 'Saturday', 'Night', 'Live', ""''"", 'vets', 'who', 'go', 'for', 'nothing', 'beyond', 'the', 'quick', 'laugh', ',', 'ca', ""n't"", 'milk', 'a', 'routine', 'to', 'save', 'his', 'life', '.', 'And', 'while', 'everyone', 'else', 'in', 'the', 'movie', 'seems', 'sincerely', 'committed', 'to', 'the', 'story', ""'s"", 'potential', 'sweetness', ',', 'Ferrell', ""'s"", 'elf', 'is', 'little', 'more', 'than', 'a', 'variation', 'on', 'his', '``', 'SNL', ""''"", 'old', 'routine', 'as', 'a', 'hyperactive', 'male', 'cheerleader', '.', 'Elf', 'is', 'inoffensive', 'enough', ',', 'and', 'kids', 'will', 'probably', 'lap', 'it', 'up', '.', 'But', 'even', 'the', 'children', 'at', 'the', 'preview', 'audience', 'seemed', 'more', 'grossed', 'out', 'than', 'cheered', 'by', 'some', 'of', 'the', 'movie', ""'s"", 'Ferrelly', 'Bros.-like', 'humor', ',', 'such', 'as', 'Buddy', 're-chewing', 'discarded', 'bubble', 'gum', 'or', 'pouring', 'maple', 'syrup', 'on', 'everything', 'he', 'eats', '.', 'If', 'you', ""'re"", 'a', 'discriminating', 'adult', ',', 'Elf', 'probably', 'wo', ""n't"", 'be', 'much', 'more', 'palatable', '.', 'Elf', 'is', 'rated', 'PG', 'for', 'minor', 'adult', 'language', 'and', 'references', '.']","[""There's a big hole at the center of Elf, and his name is Will Ferrell."", ""The movie's premise is that Santa Claus (Ed Asner) accidentally hijacks a baby to the North Pole."", ""The baby is named Buddy (played by Ferrell) and raised by a senior elf (Bob Newhart) as one of the North Pole's own."", 'Eventually, Buddy is sent back to his home town of New York to find his biological father (James Caan).', 'The opening scenes are a letter-perfect take-off on the Rankin-Bass Christmas TV specials.', ""And Newhart's straight-to-the-camera, deadpan narration sets the perfect tone."", 'But as soon as Buddy hits Manhattan, the movie starts going awry.', ""There are many scenes of broad physical comedy where Buddy is overawed by modern life and misinterprets people's commands to him."", 'If ever there was a pregnant premise for comedy, a naive, six-foot-tall elf set loose in unforgiving New York City ought to be it.', 'But Will Ferrell is not the man for the job.', 'Steve Martin and Jim Carrey have the wild abandon for this kind of thing, and heaven knows what elfin Robin Williams would have done with the role.', 'But Ferrell, another of those ""Saturday Night Live"" vets who go for nothing beyond the quick laugh, can\'t milk a routine to save his life.', 'And while everyone else in the movie seems sincerely committed to the story\'s potential sweetness, Ferrell\'s elf is little more than a variation on his ""SNL"" old routine as a hyperactive male cheerleader.', 'Elf is inoffensive enough, and kids will probably lap it up.', ""But even the children at the preview audience seemed more grossed out than cheered by some of the movie's Ferrelly Bros.-like humor, such as Buddy re-chewing discarded bubble gum or pouring maple syrup on everything he eats."", ""If you're a discriminating adult, Elf probably won't be much more palatable."", 'Elf is rated PG for minor adult language and references.']",371,213,17,0.5741239892183289
